{
  "name": "Quarterly Mapping â€” Q4 (Oct-Dec)",
  "description": "Validates Q4 claim maps to Q2 of current year index",
  "category": "edge-case",
  "tags": ["quarterly", "mapping", "Q4"],
  "input": {
    "birthYear": 1980,
    "gender": "M",
    "startWorkYear": 2000,
    "currentGrossMonthly": 6000,
    "claimMonth": 11
  },
  "structural": {
    "finalizationQuarter": "Q4",
    "explainerMinLength": 1
  }
}
